{
  "dag_id": "skilled_birth__B",
  "schema_version": "0.3.0",
  "vintage_date": "2026-10-17",
  "generated_at": "2026-10-17T07:33:43+0100",
  "generator": {
    "script": "analysis/R/01_build_dags.R",
    "git_sha": "ba5741f"
  },
  "outcome": {
    "id": "skilled_birth",
    "label": "Skilled birth attendance",
    "short": "Skilled birth attendance",
    "domain": "health",
    "unit": "% of births",
    "direction": "up",
    "frequency": "annual",
    "source": "World Bank SH.STA.BRTC.ZS (survey-based)",
    "coverage_status": "partial",
    "coverage_note": "Probed and acquired 2026-10-11: 9 observations across 33 years (density 0.27). This is a survey series, NOT an annual one — it must render as flagged survey points and cannot carry a lagged time-series design. Recorded rather than interpolated into a smooth line."
  },
  "design": {
    "id": "B",
    "name": "National VECM / ARDL time series",
    "short": "Time series",
    "unit": "national-month (annual cross-check)",
    "estimand": "long-run multiplier for the administration effect, oil-interacted",
    "estimator": "VECM (vars + urca Johansen), ARDL (dynlm) fallback per the cointegration test",
    "exposure_node": "admin",
    "outcome_node": "Y",
    "adjustment_criterion": "backdoor",
    "design_controls": [
      "Lagged outcome captures persistence (error-correction form)",
      "Linear and quadratic time trend absorb secular drift",
      "Oil price is interacted with administration, never partialled out (base spec section 9)"
    ]
  },
  "nodes": [
    {
      "id": "oil",
      "label": "Brent crude price (logged)",
      "short": "Oil price shock",
      "role": "confounder",
      "observed": true,
      "source": "FRED DCOILBRENTEU (Brent crude, daily) via ingestion/flows/pull_fred.py",
      "source_status": "acquired"
    },
    {
      "id": "lagY",
      "label": "Lagged outcome",
      "short": "Lagged outcome",
      "role": "confounder",
      "observed": true,
      "source": "Derived: lagged value of the outcome",
      "source_status": "derived"
    },
    {
      "id": "trend",
      "label": "Linear and quadratic time trend",
      "short": "Time trend",
      "role": "confounder",
      "observed": true,
      "source": "Design construct: linear and quadratic trend",
      "source_status": "construct"
    },
    {
      "id": "donor",
      "label": "Donor funding",
      "short": "Donor funding",
      "role": "confounder",
      "observed": true,
      "source": "World Bank DT.ODA.ALLD.CD (net ODA received)",
      "source_status": "acquired"
    },
    {
      "id": "u_t",
      "label": "Omitted time-varying determinant",
      "short": "Omitted time-varying factor",
      "role": "confounder",
      "observed": false,
      "source": "Unobserved: assumed absent by the conditional-exogeneity assumption",
      "source_status": "unobserved"
    },
    {
      "id": "admin",
      "label": "Administration (party x tenure)",
      "short": "Administration",
      "role": "exposure",
      "observed": true,
      "source": "Administration spine (base spec section 7)",
      "source_status": "acquired"
    },
    {
      "id": "oilxadmin",
      "label": "Oil x administration (effect modification)",
      "short": "Oil x Administration",
      "role": "modifier",
      "observed": true,
      "source": "Derived: oil x administration interaction",
      "source_status": "derived"
    },
    {
      "id": "faac",
      "label": "FAAC allocation / fiscal space",
      "short": "FAAC / fiscal space",
      "role": "mediator",
      "observed": true,
      "source": "NBS FAAC disbursement reports",
      "source_status": "gap"
    },
    {
      "id": "fx",
      "label": "NGN/USD exchange rate",
      "short": "NGN/USD",
      "role": "mediator",
      "observed": true,
      "source": "World Bank PA.NUS.FCRF (annual); CBN needed for monthly",
      "source_status": "acquired"
    },
    {
      "id": "Y",
      "label": "Skilled birth attendance",
      "short": "Skilled birth attendance",
      "role": "outcome",
      "observed": true,
      "source": "World Bank SH.STA.BRTC.ZS (survey-based)",
      "source_status": "acquired"
    }
  ],
  "edges": [
    {
      "from": "oil",
      "to": "admin"
    },
    {
      "from": "oil",
      "to": "oilxadmin"
    },
    {
      "from": "oil",
      "to": "faac"
    },
    {
      "from": "oil",
      "to": "fx"
    },
    {
      "from": "oil",
      "to": "Y"
    },
    {
      "from": "admin",
      "to": "oilxadmin"
    },
    {
      "from": "admin",
      "to": "faac"
    },
    {
      "from": "admin",
      "to": "fx"
    },
    {
      "from": "admin",
      "to": "Y"
    },
    {
      "from": "oilxadmin",
      "to": "Y"
    },
    {
      "from": "faac",
      "to": "Y"
    },
    {
      "from": "fx",
      "to": "Y"
    },
    {
      "from": "lagY",
      "to": "Y"
    },
    {
      "from": "trend",
      "to": "faac"
    },
    {
      "from": "trend",
      "to": "fx"
    },
    {
      "from": "trend",
      "to": "Y"
    },
    {
      "from": "donor",
      "to": "Y"
    },
    {
      "from": "u_t",
      "to": "admin"
    },
    {
      "from": "u_t",
      "to": "Y"
    }
  ],
  "adjustment_set": [
    "oil"
  ],
  "adjustment_sets": [
    [
      "oil"
    ]
  ],
  "assumption_required": [
    "u_t"
  ],
  "identifying_assumption": "Conditional exogeneity: given the oil price, the lagged outcome, fiscal and FX controls and the trend, the administration dummy is unrelated to any remaining time-varying determinant of the outcome (the unobserved node is absent).",
  "cannot_rule_out": [
    "FAAC and the exchange rate are downstream of the administration, so conditioning on them identifies a *direct* effect net of the fiscal and FX channel, not the total effect.",
    "Only ~26 annual observations and five administrations — the interval is wide by construction.",
    "Structural breaks (2014 rebasing, 2016 and 2023 regime changes) are not fully absorbed by trends.",
    "Oil is treated as exogenous to Nigerian policy, which the 2016 and 2020 episodes roughly support but do not prove."
  ],
  "dagitty_full": "dag {\n  oil [pos = \"0,2.8\"]\n  lagY [pos = \"0,1.6\"]\n  trend [pos = \"0,0.4\"]\n  donor [pos = \"0,-0.8\"]\n  u_t [pos = \"0,-2.0\", unobserved]\n  admin [pos = \"1.8,2.4\", exposure]\n  oilxadmin [pos = \"1.8,1.0\"]\n  faac [pos = \"1.8,-0.2\"]\n  fx [pos = \"1.8,-1.4\"]\n  Y [pos = \"3.6,0.6\", outcome]\n  oil -> admin\n  oil -> oilxadmin\n  oil -> faac\n  oil -> fx\n  oil -> Y\n  admin -> oilxadmin\n  admin -> faac\n  admin -> fx\n  admin -> Y\n  oilxadmin -> Y\n  faac -> Y\n  fx -> Y\n  lagY -> Y\n  trend -> faac\n  trend -> fx\n  trend -> Y\n  donor -> Y\n  u_t -> admin\n  u_t -> Y\n}",
  "dagitty_assumed": "dag {\n  oil [pos = \"0,2.8\"]\n  lagY [pos = \"0,1.6\"]\n  trend [pos = \"0,0.4\"]\n  donor [pos = \"0,-0.8\"]\n  admin [pos = \"1.8,2.4\", exposure]\n  oilxadmin [pos = \"1.8,1.0\"]\n  faac [pos = \"1.8,-0.2\"]\n  fx [pos = \"1.8,-1.4\"]\n  Y [pos = \"3.6,0.6\", outcome]\n  oil -> admin\n  oil -> oilxadmin\n  oil -> faac\n  oil -> fx\n  oil -> Y\n  admin -> oilxadmin\n  admin -> faac\n  admin -> fx\n  admin -> Y\n  oilxadmin -> Y\n  faac -> Y\n  fx -> Y\n  lagY -> Y\n  trend -> faac\n  trend -> fx\n  trend -> Y\n  donor -> Y\n}",
  "diagnostics": {
    "status": "degraded",
    "checks": [
      {
        "id": "integration_order",
        "verdict": "not_run",
        "detail": "only 8 native observations in the window (minimum 12) — not tested"
      },
      {
        "id": "cointegration_rank",
        "verdict": "not_run",
        "detail": "8 annual observations (minimum 20)"
      },
      {
        "id": "dof_power",
        "verdict": "not_run",
        "detail": "8 annual observations — too few to fit the Tier-3 design"
      },
      {
        "id": "collinearity",
        "verdict": "not_run",
        "detail": "8 annual observations"
      },
      {
        "id": "faac_in_tier3_system",
        "verdict": "deviation",
        "detail": "the base-spec Tier-3 system includes FAAC, which has no metric-catalogue entry (the monthly state panel landed 2026-10-16 and is Stage 3 gated, but it has no declared monthly-to-annual aggregation and no outcome decision); the system is reduced to {Y, log(oil), fx}"
      }
    ],
    "blocker": "FAAC is absent from the metric catalogue, so the Tier-3 system runs without its fiscal variable; and the grain is annual, not monthly",
    "note": "Runs, but not as base spec section 9 specifies; the deviations are listed above.",
    "coverage_status": "partial",
    "vintage": "2026-10-17",
    "source": "registry/diagnostics/2026-10-17/diagnostics.json"
  },
  "assets": {
    "svg": "registry/dags/skilled_birth__B.svg"
  },
  "estimate": {
    "status": "not_estimated",
    "model_card_ref": null,
    "the_number_is_for_this_card": false,
    "not_estimated_reason": {
      "code": "design_result_is_channel_level",
      "detail": "The design has a published result, but it is a statement about the channel the design rests on (the national FAAC series) rather than about this card's outcome. The number is on the index, once, where it cannot be mistaken for an estimate for this outcome."
    },
    "published_result": "index.json#published_results.design.B",
    "note": "No estimate for (skilled_birth, B). The design has a published result, but it measures the national FAAC channel (cumulative log change in national FAAC (the channel), national-month grain) — on this card, FAAC is a mediator node, not the outcome. The number is on the index, once, rather than on the nine B cards that would each imply it is about their outcome."
  }
}
