{
  "dag_id": "ner_primary__C",
  "schema_version": "0.3.0",
  "vintage_date": "2026-10-18",
  "generated_at": "2026-10-18T11:40:19+0100",
  "generator": {
    "script": "analysis/R/01_build_dags.R",
    "git_sha": "e0c9e68"
  },
  "outcome": {
    "id": "ner_primary",
    "label": "Net enrolment rate, primary",
    "short": "Net enrolment (primary)",
    "domain": "education",
    "unit": "%",
    "direction": "up",
    "frequency": "annual",
    "source": "NEMIS",
    "coverage_status": "declared_gap",
    "coverage_note": "Same 2010 break as primary_completion (C-03, C-07); NEMIS unreachable."
  },
  "design": {
    "id": "C",
    "name": "Synthetic control (cross-country)",
    "short": "Synthetic control",
    "unit": "country-year (Nigeria treated; West African neighbours + oil exporters)",
    "estimand": "treatment gap: Nigeria outcome minus synthetic Nigeria",
    "estimator": "Synth / coresynth / scpi, donor pool screened by pre-treatment fit",
    "exposure_node": "treat",
    "outcome_node": "Y",
    "adjustment_criterion": "backdoor",
    "design_controls": [
      "Donor weights chosen to reproduce Nigeria's pre-treatment outcome path and predictors",
      "In-space placebo across every donor; in-time placebo; leave-one-donor-out sweep",
      "Pool composition treated as a robustness axis, not a fixed choice"
    ]
  },
  "nodes": [
    {
      "id": "common",
      "label": "Common factors (global oil / commodity cycle)",
      "short": "Common factors (oil cycle)",
      "role": "confounder",
      "observed": true,
      "source": "Derived from the donor-panel paths and the FRED Brent crude cycle (node 'oil')",
      "source_status": "derived"
    },
    {
      "id": "countryfe",
      "label": "Country fixed effects",
      "short": "Country FE",
      "role": "confounder",
      "observed": true,
      "source": "Design construct: country fixed effects",
      "source_status": "construct"
    },
    {
      "id": "donors",
      "label": "Donor-pool outcome paths (synthetic weights)",
      "short": "Donor-pool paths",
      "role": "confounder",
      "observed": true,
      "source": "Donor panel: 13 countries x 5 predictors (World Bank)",
      "source_status": "acquired"
    },
    {
      "id": "treat",
      "label": "Nigeria under administration X (treated)",
      "short": "Nigeria treated (tenure)",
      "role": "exposure",
      "observed": true,
      "source": "Administration spine (base spec section 7)",
      "source_status": "acquired"
    },
    {
      "id": "Y",
      "label": "Net enrolment rate, primary",
      "short": "Net enrolment (primary)",
      "role": "outcome",
      "observed": true,
      "source": "NEMIS",
      "source_status": "gap"
    },
    {
      "id": "u_ng",
      "label": "Nigeria-specific shock coinciding with treatment",
      "short": "Nigeria-specific shock",
      "role": "confounder",
      "observed": false,
      "source": "Unobserved: assumed absent by the synthetic-control assumption",
      "source_status": "unobserved"
    }
  ],
  "edges": [
    {
      "from": "common",
      "to": "treat"
    },
    {
      "from": "common",
      "to": "donors"
    },
    {
      "from": "common",
      "to": "Y"
    },
    {
      "from": "countryfe",
      "to": "donors"
    },
    {
      "from": "countryfe",
      "to": "Y"
    },
    {
      "from": "donors",
      "to": "Y"
    },
    {
      "from": "treat",
      "to": "Y"
    },
    {
      "from": "u_ng",
      "to": "treat"
    },
    {
      "from": "u_ng",
      "to": "Y"
    }
  ],
  "adjustment_set": [
    "common"
  ],
  "adjustment_sets": [
    [
      "common"
    ]
  ],
  "assumption_required": [
    "u_ng"
  ],
  "identifying_assumption": "The synthetic control reproduces Nigeria's outcome path absent treatment: donor-weighted common factors (above all the global oil and commodity cycle) stand in for Nigeria's counterfactual, and no Nigeria-specific shock coincides with the treatment (the unobserved node is absent).",
  "cannot_rule_out": [
    "Idiosyncratic Nigeria-only shocks inside the treatment window (Niger Delta militancy, insurgency).",
    "Five treated tenures is a small treated set — the donor pool cannot always buy a credible counterfactual.",
    "Sparse pre-treatment fit weakens the comparison, and the card must say so rather than ship the gap.",
    "Contemporaneous global shocks affect donors differently than Nigeria even when the oil channel is shared."
  ],
  "dagitty_full": "dag {\n  common [pos = \"0,1.8\"]\n  countryfe [pos = \"0,0.6\"]\n  donors [pos = \"0,-0.8\"]\n  treat [pos = \"1.8,1.8\", exposure]\n  Y [pos = \"3.6,0.6\", outcome]\n  u_ng [pos = \"1.8,-0.9\", unobserved]\n  common -> treat\n  common -> donors\n  common -> Y\n  countryfe -> donors\n  countryfe -> Y\n  donors -> Y\n  treat -> Y\n  u_ng -> treat\n  u_ng -> Y\n}",
  "dagitty_assumed": "dag {\n  common [pos = \"0,1.8\"]\n  countryfe [pos = \"0,0.6\"]\n  donors [pos = \"0,-0.8\"]\n  treat [pos = \"1.8,1.8\", exposure]\n  Y [pos = \"3.6,0.6\", outcome]\n  common -> treat\n  common -> donors\n  common -> Y\n  countryfe -> donors\n  countryfe -> Y\n  donors -> Y\n  treat -> Y\n}",
  "diagnostics": {
    "status": "not_attempted",
    "checks": [
      {
        "id": "pretreatment_fit",
        "verdict": "not_run",
        "detail": "outcome ner_primary is not in the donor panel (predictors: cpi_yoy, gdp_growth, oil_rents, population, u5mr)"
      },
      {
        "id": "donor_pool_coverage",
        "verdict": "computed",
        "detail": "99 donors x 5 predictors; Venezuela's oil-rents series ends 2014 (C-19)"
      }
    ],
    "blocker": "outcome ner_primary is not in the donor panel (predictors: cpi_yoy, gdp_growth, oil_rents, population, u5mr)",
    "note": "No candidate window is testable for this outcome",
    "coverage_status": "declared_gap",
    "vintage": "2026-10-18",
    "source": "registry/diagnostics/2026-10-18/diagnostics.json"
  },
  "assets": {
    "svg": "registry/dags/ner_primary__C.svg"
  },
  "estimate": {
    "status": "not_estimated",
    "model_card_ref": null,
    "the_number_is_for_this_card": false,
    "not_estimated_reason": {
      "code": "outcome_series_absent",
      "detail": "The outcome has no usable series, so no Stage 5 pre-check could run for this (outcome, design) pair. The card is a declared gap, not a null result."
    },
    "published_result": "index.json#published_results.design.C",
    "note": "No estimate for (ner_primary, C). The outcome series is absent, so no pre-check ran for this pair (Stage 5 status not_attempted). This is a declared gap, not a null result."
  }
}
